{
    "$schema": "http://json-schema.org/draft-07/schema#",
    "properties": {
        "description": {
            "type": "string"
        },
        "id": {
            "type": "string"
        },
        "link": {
            "type": "string"
        },
        "name": {
            "type": "string"
        },
        "title": {
            "type": "string"
        }
    },
    "type": "object"
}
